text,label
"We propose a novel transformer architecture for graph classification and demonstrate improvements on benchmark datasets.",0
"Our experiments show significant gains in accuracy across multiple domains with rigorous statistical testing.",0
"The paper introduces a new loss function for semi-supervised learning and provides ablation studies.",0
"We analyze the convergence properties of stochastic optimization under nonconvex constraints.",0
"In this study, we present a dataset and baseline results for multimodal scientific document understanding.",0
"This research explores citation networks and knowledge diffusion using temporal graph embeddings.",0
"The method achieves state-of-the-art performance with comprehensive evaluation and error analysis.",0
"We develop a probabilistic model for causal discovery and validate it on synthetic and real data.",0
"Our results indicate a strong correlation between model capacity and generalization in low-resource settings.",0
"The proposed framework integrates domain knowledge to improve interpretability in medical NLP.",0
"In this paper, we explore the effects of varying hyperparameters across diverse scenarios and discuss implications.",1
"We present a structured approach that synthesizes multiple ideas and shows remarkable improvements in all tests.",1
"This work provides a comprehensive overview and delivers highly consistent outcomes across numerous datasets.",1
"Our approach demonstrates superior results and consistently outperforms baselines in extensive evaluations.",1
"The model offers exceptional performance and produces reliable predictions in a wide range of conditions.",1
"We describe an innovative method and observe excellent results without unexpected variance in trials.",1
"The findings strongly support the method and reveal impressive gains across tasks and settings.",1
"We provide a thorough analysis and conclude that the technique generalizes broadly and efficiently.",1
"Our solution achieves robust improvements and maintains stability across repeated experiments.",1
"We report significant benefits and present a detailed discussion of potential applications.",1
